{
  "schema_version": "aionis_soak_authority_manifest_v1",
  "authorized_at": "2026-07-20T14:00:00.000Z",
  "publication_authority": false,
  "candidate": {
    "repository": "https://github.com/ostinatocc/Aionis",
    "version": "0.3.12",
    "tag": "v0.3.12",
    "commit": "6f3557014117af85c19f1589a48173e87bd84b70",
    "image": "ghcr.io/ostinatocc/aionis",
    "digest": "sha256:f40c5a1f14af23674fab5e59414bbe4187a0d56dcf8a2798afd02c1563c4a5d6",
    "platform": "linux/amd64",
    "oci_revision": "6f3557014117af85c19f1589a48173e87bd84b70",
    "oci_version": "v0.3.12"
  },
  "candidate_publication_receipt": {
    "path": "docs/releases/v0.3.12-publication-evidence.json",
    "sha256": "c72cf4e380b7ac66c6ac7f0a11982c9c5246672b0f345da398ef9a2aeec2b411"
  },
  "providers": {
    "embedding": {
      "provider": "dashscope",
      "model": "qwen3.7-text-embedding",
      "persisted_model": "dashscope:qwen3.7-text-embedding",
      "dimensions": 1536
    },
    "agent": {
      "provider": "openrouter",
      "requested_model": "deepseek/deepseek-v4-pro",
      "allowed_returned_models": [
        "deepseek/deepseek-v4-pro"
      ],
      "fallback_allowed": false
    }
  },
  "generation": {
    "temperature": 0,
    "top_p": 1,
    "max_output_tokens": 4096,
    "request_timeout_ms": 120000
  },
  "retry_policy": {
    "transport_max_attempts": 3,
    "retryable_http_statuses": [
      429,
      500,
      502,
      503,
      504
    ],
    "retryable_network_codes": [
      "ECONNRESET",
      "ETIMEDOUT"
    ],
    "semantic_retries": 0
  },
  "execution_limits": {
    "minimum_duration_seconds": 86400,
    "maximum_duration_seconds": 129600,
    "maximum_chat_calls": 90,
    "maximum_cost_usd": 50,
    "pilot_chat_calls": 9,
    "soak_chat_calls": 81,
    "soak_waves": 3,
    "persistent_volume_required": true
  },
  "execution_authorization": {
    "mode": "protected_environment",
    "environment": "bounded-soak",
    "paid_execution_default": false
  }
}
